{
  "schema_version": 1,
  "profiles": [
    {
      "id": "A",
      "name": "full-coding-runtime",
      "capabilities": [
        "artifact.inline",
        "filesystem.read",
        "filesystem.write",
        "source_control.read",
        "source_control.write",
        "shell.execute",
        "test.execute",
        "web.read",
        "connector.discover"
      ]
    },
    {
      "id": "B",
      "name": "chat-runtime",
      "capabilities": [
        "artifact.inline",
        "provided_content.read",
        "web.read",
        "connector.discover"
      ]
    },
    {
      "id": "C",
      "name": "offline-local-runtime",
      "capabilities": [
        "artifact.inline",
        "filesystem.read",
        "filesystem.write",
        "source_control.read",
        "source_control.write",
        "shell.execute",
        "test.execute"
      ]
    },
    {
      "id": "D",
      "name": "docs-only-runtime",
      "capabilities": [
        "artifact.inline",
        "provided_content.read"
      ]
    }
  ],
  "workflows": [
    {
      "skill": "project-bootstrap",
      "skill_path": "skills/project-bootstrap/SKILL.md",
      "semantic_contract": "Discover project truth, live capability, policy, and retention; persist only when approved."
    },
    {
      "skill": "capability-resolver",
      "skill_path": "skills/capability-resolver/SKILL.md",
      "semantic_contract": "Resolve an abstract capability against live discovery, policy, approval, and explicit fallback."
    },
    {
      "skill": "research",
      "skill_path": "skills/research/SKILL.md",
      "semantic_contract": "Answer a decision-relevant question with source authority, provenance, contradiction, and truthful incompleteness."
    },
    {
      "skill": "handoff",
      "skill_path": "skills/handoff/SKILL.md",
      "semantic_contract": "Transfer continuation state through canonical references, privacy, retention, and verified delivery."
    },
    {
      "skill": "resolving-merge-conflicts",
      "skill_path": "skills/resolving-merge-conflicts/SKILL.md",
      "semantic_contract": "Resolve an existing source-control conflict without inventing behavior, losing unrelated state, or assuming commit authority."
    }
  ],
  "scenarios": [
    {
      "scenario_id": "a-project-bootstrap",
      "profile": "A",
      "skill": "project-bootstrap",
      "declared_scope": "Discover and persist an approved project capability profile.",
      "required_capabilities": [
        "filesystem.read",
        "filesystem.write",
        "connector.discover"
      ],
      "available_capabilities": [
        "artifact.inline",
        "filesystem.read",
        "filesystem.write",
        "source_control.read",
        "source_control.write",
        "shell.execute",
        "test.execute",
        "web.read",
        "connector.discover"
      ],
      "missing_required_capabilities": [],
      "fallback_mode": "NONE",
      "expected_state": "READY",
      "actions_claimed": [
        "profile-discovered",
        "profile-persisted",
        "persistence-verified"
      ],
      "actions_not_run": [],
      "forbidden_claims": [
        "all configured providers are live",
        "persistence grants side-effect authority"
      ],
      "notes": ""
    },
    {
      "scenario_id": "b-project-bootstrap",
      "profile": "B",
      "skill": "project-bootstrap",
      "declared_scope": "Discover supplied/connected project truth and return an inline profile.",
      "required_capabilities": [
        "provided_content.read",
        "artifact.inline"
      ],
      "available_capabilities": [
        "artifact.inline",
        "provided_content.read",
        "web.read",
        "connector.discover"
      ],
      "missing_required_capabilities": [],
      "fallback_mode": "INLINE",
      "expected_state": "PARTIAL",
      "actions_claimed": [
        "profile-returned-inline"
      ],
      "actions_not_run": [
        "profile-persisted",
        "filesystem-discovery"
      ],
      "forbidden_claims": [
        "profile file created",
        "repository convention inspected"
      ],
      "notes": ""
    },
    {
      "scenario_id": "c-project-bootstrap",
      "profile": "C",
      "skill": "project-bootstrap",
      "declared_scope": "Discover local project truth and persist a local profile without remote discovery.",
      "required_capabilities": [
        "filesystem.read",
        "filesystem.write"
      ],
      "available_capabilities": [
        "artifact.inline",
        "filesystem.read",
        "filesystem.write",
        "source_control.read",
        "source_control.write",
        "shell.execute",
        "test.execute"
      ],
      "missing_required_capabilities": [],
      "fallback_mode": "LOCAL_ONLY",
      "expected_state": "READY",
      "actions_claimed": [
        "local-profile-discovered",
        "profile-persisted",
        "persistence-verified"
      ],
      "actions_not_run": [
        "remote-provider-discovery"
      ],
      "forbidden_claims": [
        "remote providers confirmed unavailable rather than unknown"
      ],
      "notes": ""
    },
    {
      "scenario_id": "d-project-bootstrap",
      "profile": "D",
      "skill": "project-bootstrap",
      "declared_scope": "Construct an inline draft profile from supplied documents only.",
      "required_capabilities": [
        "provided_content.read",
        "artifact.inline"
      ],
      "available_capabilities": [
        "artifact.inline",
        "provided_content.read"
      ],
      "missing_required_capabilities": [],
      "fallback_mode": "INLINE",
      "expected_state": "PARTIAL",
      "actions_claimed": [
        "draft-profile-returned-inline"
      ],
      "actions_not_run": [
        "live-capability-discovery",
        "profile-persisted"
      ],
      "forbidden_claims": [
        "live environment inspected",
        "canonical profile written"
      ],
      "notes": ""
    },
    {
      "scenario_id": "a-capability-resolver",
      "profile": "A",
      "skill": "capability-resolver",
      "declared_scope": "Resolve source_control.commit with live provider discovery and policy evidence.",
      "required_capabilities": [
        "connector.discover",
        "source_control.read"
      ],
      "available_capabilities": [
        "artifact.inline",
        "filesystem.read",
        "filesystem.write",
        "source_control.read",
        "source_control.write",
        "shell.execute",
        "test.execute",
        "web.read",
        "connector.discover"
      ],
      "missing_required_capabilities": [],
      "fallback_mode": "NONE",
      "expected_state": "READY",
      "actions_claimed": [
        "provider-resolution-recorded"
      ],
      "actions_not_run": [
        "commit-executed"
      ],
      "forbidden_claims": [
        "approval granted by resolver",
        "commit performed"
      ],
      "notes": "Capability Resolver scope ends with a resolution record; commit execution remains owned by the calling workflow and project policy."
    },
    {
      "scenario_id": "b-capability-resolver",
      "profile": "B",
      "skill": "capability-resolver",
      "declared_scope": "Resolve browser/read capability using runtime discovery.",
      "required_capabilities": [
        "connector.discover",
        "web.read"
      ],
      "available_capabilities": [
        "artifact.inline",
        "provided_content.read",
        "web.read",
        "connector.discover"
      ],
      "missing_required_capabilities": [],
      "fallback_mode": "NONE",
      "expected_state": "READY",
      "actions_claimed": [
        "read-provider-resolved"
      ],
      "actions_not_run": [],
      "forbidden_claims": [
        "external write authorized",
        "filesystem provider available"
      ],
      "notes": ""
    },
    {
      "scenario_id": "c-capability-resolver",
      "profile": "C",
      "skill": "capability-resolver",
      "declared_scope": "Resolve an external tracker write with no network provider and no approved fallback.",
      "required_capabilities": [
        "connector.discover"
      ],
      "available_capabilities": [
        "artifact.inline",
        "filesystem.read",
        "filesystem.write",
        "source_control.read",
        "source_control.write",
        "shell.execute",
        "test.execute"
      ],
      "missing_required_capabilities": [
        "connector.discover"
      ],
      "fallback_mode": "NONE",
      "expected_state": "BLOCKED",
      "actions_claimed": [],
      "actions_not_run": [
        "external-tracker-write"
      ],
      "forbidden_claims": [
        "tracker item created",
        "local file is automatic canonical fallback"
      ],
      "notes": ""
    },
    {
      "scenario_id": "d-capability-resolver",
      "profile": "D",
      "skill": "capability-resolver",
      "declared_scope": "Assess a requested provider from supplied docs without live discovery.",
      "required_capabilities": [
        "connector.discover"
      ],
      "available_capabilities": [
        "artifact.inline",
        "provided_content.read"
      ],
      "missing_required_capabilities": [
        "connector.discover"
      ],
      "fallback_mode": "NONE",
      "expected_state": "BLOCKED",
      "actions_claimed": [],
      "actions_not_run": [
        "provider-selection",
        "provider-operation"
      ],
      "forbidden_claims": [
        "configured provider is live",
        "authentication exists"
      ],
      "notes": ""
    },
    {
      "scenario_id": "a-research",
      "profile": "A",
      "skill": "research",
      "declared_scope": "Research current external and local implementation behavior with traceable sources.",
      "required_capabilities": [
        "web.read",
        "filesystem.read"
      ],
      "available_capabilities": [
        "artifact.inline",
        "filesystem.read",
        "filesystem.write",